<?xml version="1.0" encoding="UTF-8"?>
<!ELEMENT preguntas (pregunta+)>
<!ELEMENT pregunta (type,title,option*,answer+)>
<!ELEMENT type (#PCDATA)>
<!ELEMENT title (#PCDATA)>
<!ELEMENT option (#PCDATA)>
<!ELEMENT answer (#PCDATA)>